{
    "$schema": "https://json-schema.org/draft/2020-12/schema",
    "$id": "urn:pickle:schemas:artefacts:domains:business:conceptual:BUS-BCM",
    "title": "Business Capability Model",
    "description": "Visual map of the Business Capabilities Catalogue (BUS-CAP), arranged as a nested card diagram: Level 1 capabilities as groups, Level 2 capabilities as items within each group, and optionally Level 3 capabilities nested within each Level 2 item. The overview renders Levels 1-2 on one slide; when Level 3 data is present, a drill-down diagram per Level 1 capability follows, showing its Level 2 cards with their Level 3 capabilities inside. Derived from BUS-CAP rather than authored directly.",
    "meta": {
        "domain": "business",
        "abstraction": "conceptual",
        "format": "diagram",
        "description": "A visual map of the organisation's capabilities, arranged as a nested hierarchy.",
        "purpose": [
            "Give a single-page view of the capability landscape for workshops and roadmap discussions.",
            "Highlight which capabilities are strategic, differentiating, or foundational at a glance.",
            "Drill into each Level 1 capability to see its Level 2 and Level 3 breakdown.",
            "Provide an embeddable diagram for presentations, kept in sync with BUS-CAP."
        ],
        "diagramType": "card-based",
        "countLabels": {
            "groups": "Level 1",
            "items": "Level 2",
            "subitems": "Level 3"
        }
    },
    "type": "object",
    "required": [
        "groups"
    ],
    "properties": {
        "$schema": {
            "type": "string",
            "description": "URN of the schema this instance conforms to (this file's $id)."
        },
        "audience": {
            "$ref": "urn:pickle:schemas:roles#/$defs/role-list",
            "description": "Roles this artefact is written for (its readers)."
        },
        "author": {
            "$ref": "urn:pickle:schemas:roles#/$defs/role-list",
            "description": "Roles responsible for authoring and maintaining this artefact."
        },
        "groups": {
            "type": "array",
            "description": "Level 1 capabilities, each containing its Level 2 sub-capabilities.",
            "items": {
                "$ref": "#/$defs/group"
            }
        },
        "activity": {
            "type": "array",
            "description": "Chronological activity / change-history log.",
            "items": {
                "$ref": "#/$defs/activity-entry"
            }
        }
    },
    "additionalProperties": false,
    "$defs": {
        "group": {
            "type": "object",
            "description": "A Level 1 capability and its Level 2 sub-capabilities, matching the corresponding entries in BUS-CAP.",
            "required": [
                "id",
                "name",
                "items"
            ],
            "properties": {
                "id": {
                    "type": "string",
                    "description": "Level 1 capability ID, matching BUS-CAP."
                },
                "name": {
                    "type": "string",
                    "description": "Level 1 capability name, matching BUS-CAP."
                },
                "meta": {
                    "type": "object",
                    "description": "Additional display attributes for this capability card. Open-ended — only 'importance' is currently rendered.",
                    "properties": {
                        "importance": {
                            "type": "string",
                            "enum": [
                                "strategic",
                                "differentiating",
                                "foundational"
                            ],
                            "description": "Strategic importance, matching BUS-CAP. Rendered as a badge on the card."
                        }
                    },
                    "additionalProperties": true
                },
                "items": {
                    "type": "array",
                    "description": "Level 2 sub-capabilities belonging to this capability.",
                    "items": {
                        "$ref": "#/$defs/item"
                    }
                }
            },
            "additionalProperties": false
        },
        "item": {
            "type": "object",
            "description": "A Level 2 sub-capability, matching the corresponding entry in BUS-CAP. May contain its Level 3 capabilities as nested items, rendered in the per-Level-1 drill-down diagrams.",
            "required": [
                "id",
                "name"
            ],
            "properties": {
                "id": {
                    "type": "string",
                    "description": "Level 2 capability ID, matching BUS-CAP."
                },
                "name": {
                    "type": "string",
                    "description": "Level 2 capability name, matching BUS-CAP."
                },
                "meta": {
                    "type": "object",
                    "description": "Additional display attributes for this card. Open-ended; none are currently rendered.",
                    "additionalProperties": true
                },
                "items": {
                    "type": "array",
                    "description": "Level 3 capabilities belonging to this Level 2 sub-capability, matching BUS-CAP. Optional — omit when there are none.",
                    "items": {
                        "$ref": "#/$defs/subitem"
                    }
                }
            },
            "additionalProperties": false
        },
        "subitem": {
            "type": "object",
            "description": "A Level 3 capability, matching the corresponding entry in BUS-CAP.",
            "required": [
                "id",
                "name"
            ],
            "properties": {
                "id": {
                    "type": "string",
                    "description": "Level 3 capability ID, matching BUS-CAP."
                },
                "name": {
                    "type": "string",
                    "description": "Level 3 capability name, matching BUS-CAP."
                },
                "meta": {
                    "type": "object",
                    "description": "Additional display attributes for this card. Open-ended; none are currently rendered.",
                    "additionalProperties": true
                }
            },
            "additionalProperties": false
        },
        "activity-entry": {
            "type": "object",
            "required": [
                "timestamp",
                "action",
                "who"
            ],
            "properties": {
                "timestamp": {
                    "type": "string",
                    "description": "ISO 8601 datetime."
                },
                "action": {
                    "type": "string",
                    "enum": [
                        "Created",
                        "Updated",
                        "Archived",
                        "Deleted"
                    ],
                    "description": "The kind of change."
                },
                "who": {
                    "type": "string",
                    "description": "Display name of the person or agent."
                },
                "notes": {
                    "type": "string"
                }
            },
            "additionalProperties": false
        }
    }
}
